,Sentence,Sentence Encodings
0,"If you buy through a BGR link, we may earn an affiliate commission, helping support our expert product labs.","{'expert product': '1', 'a BGR link': '0', 'you': '0', 'our expert product labs': '1', 'an affiliate commission': '0', 'may earn': '1', 'helping support': '1', 'buy': '0', 'affiliate commission': '0', 'product labs': '0', 'we': '0', 'BGR': '0', 'link,': '0', 'may': '0', 'earn': '1', 'affiliate': '0', 'commission,': '0', 'helping': '1', 'support': '1', 'expert': '0', 'product': '0', 'labs.': '0'}"
1,"OpenAI on Monday announced major improvements to its flagship chatbot, ChatGPT, including improvements to voice, text and vision capabilities that would make “faster” services available to all users, and a new desktop app.","{'announced': '0', 'vision capabilities': '1', 'desktop app': '0', 'OpenAI': '0', 'its flagship chatbot': '1', 'Monday': '0', 'new desktop': '0', 'including': '0', '“faster” services': '1', 'vision': '0', 'would make': '0', 'major improvements': '1', 'a new desktop app': '0', 'improvements': '1', 'ChatGPT': '0', 'all users': '1', 'flagship chatbot': '1', 'capabilities': '0', 'voice': '0', 'text': '0', 'that': '0', 'major': '1', 'flagship': '1', 'chatbot,': '0', 'ChatGPT,': '0', 'voice,': '0', 'would': '0', 'make': '0', '“faster”': '1', 'services': '0', 'available': '1', 'users,': '0', 'new': '0', 'desktop': '0', 'app.': '0'}"
2,"Another perk is that Adobe Firefly was trained on Adobe Stock images, openly licensed content, and public domain content, making all the images generated safe for commercial use and addressing the ethics issue of image generators. ","{'all the images': '0', 'Adobe Stock images': '0', 'public domain content': '0', 'the ethics issue': '1', 'generated': '0', 'ethics issue': '1', 'Another perk': '1', 'commercial use': '0', 'making': '0', 'image generators': '0', 'openly licensed content': '1', 'addressing': '1', 'public domain': '0', 'trained': '0', 'Adobe Firefly': '0', 'domain content': '0', 'openly licensed': '1', 'Another': '0', 'perk': '1', 'Adobe': '0', 'Firefly': '0', 'Stock': '0', 'images,': '0', 'openly': '1', 'licensed': '0', 'content,': '0', 'public': '0', 'domain': '0', 'images': '0', 'safe': '1', 'commercial': '0', 'use': '0', 'ethics': '1', 'issue': '0', 'image': '0', 'generators.': '0', '': '0'}"
3,"“In Vice President Harris, Michigan voters have a presidential candidate they can count on to focus on lowering their costs, restoring their freedoms, bringing jobs and supply chains back home from overseas, and building an economy that works for working people,"" Whitmer said in a statement on Monday.","{'works': '1', 'supply chains': '0', 'working people': '0', 'said': '0', 'Monday': '0', 'to focus': '0', 'an economy': '0', 'have': '0', 'presidential candidate': '0', 'Michigan voters': '0', 'their freedoms': '1', 'building': '1', 'Whitmer': '0', 'home bringing': '0', 'they': '0', 'Vice President Harris': '0', 'working': '1', 'restoring': '1', 'a statement': '0', 'lowering': '1', 'their costs': '0', 'that': '0', 'can count': '1', 'jobs and supply chains': '0', 'a presidential candidate': '0', '“In': '0', 'Vice': '0', 'President': '0', 'Harris,': '0', 'Michigan': '0', 'voters': '0', 'presidential': '0', 'candidate': '0', 'count': '1', 'focus': '0', 'costs,': '0', 'freedoms,': '1', 'bringing': '1', 'jobs': '0', 'supply': '0', 'chains': '0', 'back': '1', 'home': '0', 'overseas,': '0', 'economy': '0', 'people,""': '0', 'statement': '0', 'Monday.': '0'}"
4,"White House forecasts showed increasing optimism that the U.S. economy is having a ""soft landing,"" reining in inflation without causing a recession. Biden said last week that he expected the Federal Reserve to begin cutting interest rates.","{'a recession': '0', 'inflation': '0', 'is having': '0', 'White House forecasts': '0', 'last week': '0', 'said': '0', 'he': '0', 'cutting': '0', 'increasing': '1', 'a ""soft landing': '1', 'showed': '0', 'Biden': '0', 'causing': '0', 'the Federal Reserve': '0', 'the U.S. economy': '0', 'interest rates': '0', 'increasing optimism': '1', 'to begin': '0', 'reining': '1', 'soft landing': '1', 'expected': '0', 'White': '0', 'House': '0', 'forecasts': '0', 'optimism': '1', 'U.S.': '0', 'economy': '0', '""soft': '1', 'landing,""': '0', 'without': '1', 'recession.': '0', 'last': '0', 'week': '0', 'Federal': '0', 'Reserve': '0', 'begin': '0', 'interest': '0', 'rates.': '0'}"
5,"Sen. Bob Casey, D-Pa., echoed the gratitude for Biden’s “exemplary career in public service.”","{'Pa.': '0', 'the gratitude': '1', 'exemplary career': '1', 'D': '0', 'public service': '1', 'Sen. Bob Casey': '0', 'echoed': '1', 'Biden’s “exemplary career': '1', 'Sen.': '0', 'Bob': '0', 'Casey,': '0', 'D-Pa.,': '0', 'gratitude': '1', 'Biden’s': '0', '“exemplary': '1', 'career': '0', 'public': '1', 'service.”': '1'}"
6,"“It would bring global trade to a halt and trigger a Smoot-Hawley moment – and possibly set off a global depression. It’s ludicrous,” Sonnenfeld said, referring to the Smoot-Hawley Act of 1930 that slapped tariffs on all countries and worsened the Great Depression.","{'global trade': '0', 'tariffs': '0', 'global depression': '1', 'would bring': '0', 'said': '0', 'Sonnenfeld': '0', 'a Smoot-Hawley moment': '0', 'trigger': '1', 'the Great Depression': '1', '’s': '0', 'a halt': '1', 'worsened': '1', 'a global depression': '1', 'referring': '0', 'all countries': '0', 'It': '0', 'the Smoot-Hawley Act': '0', 'that': '0', 'possibly set': '1', 'slapped': '1', '“It': '0', 'would': '0', 'bring': '0', 'global': '0', 'trade': '0', 'halt': '1', 'Smoot-Hawley': '0', 'moment': '0', '–': '0', 'possibly': '0', 'set': '1', 'depression.': '1', 'It’s': '0', 'ludicrous,”': '1', 'said,': '0', 'Act': '0', '1930': '0', 'countries': '0', 'Great': '1', 'Depression.': '1'}"
7,"The Democrat leader “has made lowering costs for hardworking families his top economic priority”, they added.","{'added': '0', 'his top economic priority': '1', 'hardworking': '1', 'lowering': '1', 'The Democrat leader': '0', 'families': '0', 'economic priority': '1', 'costs': '1', 'they': '0', 'has made': '0', 'Democrat': '0', 'leader': '0', '“has': '0', 'made': '0', 'top': '1', 'economic': '0', 'priority”,': '1', 'added.': '0'}"
